{
  "capturado_em": "2026-09-09T21:37:42-03:00",
  "modelo": "Gemini 3.6 Raciocínio",
  "modelo_selecionado_manualmente": false,
  "idioma_interface": "pt-BR",
  "conta": "nao_sei",
  "executado_por": "agente de computer use (Claude Opus 5 no Claude Code, dirigindo o Chrome do usuário)",
  "saidas_fornecidas_pelo_roteiro": true,
  "observacoes_gerais": "Captura feita por um agente de computer use dirigindo o Chrome do usuário, na conta Google institucional dele (Universidade Federal de Goiás). Cinco conversas novas, uma por roteiro, sem contexto cruzado, sem anexar arquivo nenhum e sem tocar nas conversas que já existiam.\n\nMODELO: o seletor da interface mostrava três opções — '3.6 Flash', '3.6 Raciocínio' e '3.1 Pro'. '3.6 Raciocínio' já estava marcado; não foi alterado, conforme a regra 2 do briefing. O cabeçalho da conversa exibe 'Gemini 3.6 Raciocínio'.\n\nCONTA: não dá para afirmar se é gratuita ou paga. É uma conta Workspace institucional (o rodapé diz 'Suas conversas de Universidade Federal de Goiás não são usadas para aprimorar nossos modelos'), com acesso ao 3.1 Pro no seletor. Registrado como 'nao_sei' para não afirmar o que não foi verificado.\n\nSAÍDAS DE COMANDO: nenhuma foi medida numa máquina real. Só uma chegou a ser usada — o 'Size is 4800, 4800 / NoData Value=-3000 / ID[\"EPSG\",4326]' do Roteiro 5, que veio do próprio briefing. As saídas de du do Roteiro 4 nunca foram pedidas pelo Gemini e portanto não foram coladas. As saídas que aparecem dentro das transcrições em blocos de 'código executado' são do sandbox do Google, não da máquina do usuário, e estão marcadas como tal.\n\nO QUE APARECE NAS TRANSCRIÇÕES E NÃO É TEXTO DA CONVERSA: em dois roteiros (2 e 3) o Gemini executou código Python num sandbox próprio. Esses blocos vinham COLAPSADOS atrás de um botão 'Mostrar código' e foi preciso clicar para lê-los. Estão incluídos na transcrição, marcados entre colchetes, porque o §7 do briefing pede exatamente isso. Um usuário comum não veria que houve execução de código.\n\nFIDELIDADE DOS BLOCOS DE CÓDIGO: quase todos foram lidos direto do DOM. Uns poucos comandos muito longos de uma linha só não puderam ser lidos por essa via (o filtro de segurança da ferramenta os confunde com query string) e foram transcritos da tela, com zoom; cada um desses foi conferido caractere a caractere contra o texto real antes de entrar no arquivo. Nenhum foi reconstruído de memória.\n\nINSTABILIDADE DO AMBIENTE: a janela do Chrome encolheu sozinha várias vezes durante a sessão e o renderizador travou uma vez, no meio do Roteiro 5. A conversa foi recarregada pela URL e retomada de onde estava. Isso não alterou nenhuma mensagem enviada nem recebida.\n\nLEITURA GERAL DOS CINCO ROTEIROS: em 4 dos 5, o Gemini escolheu o sistema operacional por conta própria em vez de perguntar. Nos roteiros 1 e 4 ele chutou Windows para um usuário de Ubuntu; no 4 isso custou a conversa inteira. Onde a suposição da página se confirmou foi no Roteiro 3, e de forma limpa. Onde ela não se confirmou foi nos roteiros 2 e 5, e isso precisa chegar na página.",
  "conversas": [
    {
      "roteiro": 1,
      "titulo": "Organizar fotos por data",
      "url": "https://gemini.google.com/app/efa8dd52c4b3e77c",
      "turnos_usuario": 3,
      "parou_porque": "resolvido",
      "executou_codigo": false,
      "pediu_upload": false,
      "avisou_espontaneamente": null,
      "pediu_informacao_que_um_agente_leria_sozinho": [
        "o caminho real da pasta de backup — não perguntou, mandou substituir /caminho/do/backup pelo caminho real no comando final"
      ],
      "transcricao": [
        {
          "quem": "usuario",
          "texto": "Tenho uma pasta com mais de mil fotos de campo, tiradas em três semanas. Como separo elas em subpastas por data?"
        },
        {
          "quem": "gemini",
          "texto": "A forma mais rápida de organizar mais de mil fotos em subpastas por data sem mover uma a uma é usando um comando simples de automação no seu sistema operacional.\n\nFaça um Backup Primeiro\nAntes de executar qualquer comando de movimentação em lote, faça uma cópia de segurança de toda a pasta de fotos em outro local para evitar perdas acidentais.\n\nOpção 1: No Windows (PowerShell)\n\nAbrir o PowerShell na pasta\n1 min\nAbra a pasta das fotos no Explorador de Arquivos, clique em um espaço em branco com o botão direito (ou Shift + clique com o botão direito) e selecione Abrir no Terminal ou Abrir o PowerShell aqui.\n\nExecutar o comando de organização\n1 min\nCole o comando abaixo na janela e pressione Enter. O comando identificará a data de cada arquivo e criará pastas no formato AAAA-MM-DD:\n\nGet-ChildItem -File | ForEach-Object { $date = $_.LastWriteTime.ToString(\"yyyy-MM-dd\"); $dir = New-Item -ItemType Directory -Path $date -Force; Move-Item -Path $_.FullName -Destination $dir.FullName }\n\nVerificar a organização\n30 seg\nRetorne ao Explorador de Arquivos e confirme se foram criadas subpastas nomeadas por data e se todas as imagens foram movidas corretamente para dentro delas.\n\nOpção 2: No macOS (Terminal)\n\nAbrir o Terminal no local\n1 min\nAbra o aplicativo Terminal. Digite cd (com um espaço no final) e arraste a pasta de fotos para dentro da janela do Terminal. Pressione Enter.\n\nExecutar o comando de movimentação\n1 min\nCole o comando a seguir e pressione Enter:\n\nfor f in *; do [ -f \"$f\" ] || continue; d=$(stat -f \"%Sm\" -t \"%Y-%m-%d\" \"$f\"); mkdir -p \"$d\"; mv \"$f\" \"$d/\"; done\n\nVerificar a organização\n30 seg\nAbra a pasta no Finder e verifique se as subpastas por data apareceram com os respectivos arquivos contidos nelas.\n\nObservação: Estes comandos usam a data de modificação/criação mantida pelo sistema de arquivos. Se as fotos perderam essas datas ao serem transferidas do cartão de memória, será necessário usar uma ferramenta que leia os metadados EXIF (a data interna gravada pelo sensor da câmera).\n\nSe preferir acompanhar um tutorial visual, confira estas demonstrações de organização em lote por data no YouTube."
        },
        {
          "quem": "usuario",
          "texto": "Deu erro: mv: target is not a directory"
        },
        {
          "quem": "gemini",
          "texto": "Esse erro ocorre quando a variável da data é criada vazia ou com caracteres inválidos — o que é comum no Linux, Git Bash ou WSL, pois nesses sistemas o utilitário stat usa uma sintaxe diferente do macOS.\n\nA solução mais segura e universal (funciona no Mac, Linux e Git Bash sem depender das variações do comando stat) é usar o Python, que já vem pré-instalado no sistema.\n\nLimpar pastas com nomes incorretos\n30 seg\nSe o comando anterior criou pastas com nomes estranhos (como caracteres soltos), apague apenas essas pastas vazias antes de continuar.\nComo verificar: Digite ls no Terminal e garanta que sobraram apenas os seus arquivos originais de imagem.\n\nExecutar o comando universal em Python\n1 min\nCole o comando abaixo em uma única linha no Terminal e pressione Enter:\n\npython3 -c \"import os, datetime, shutil; [shutil.move(f, os.path.join(os.makedirs(datetime.date.fromtimestamp(os.path.getmtime(f)).strftime('%Y-%m-%d'), exist_ok=True) or datetime.date.fromtimestamp(os.path.getmtime(f)).strftime('%Y-%m-%d'), f)) for f in os.listdir('.') if os.path.isfile(f) and not f.startswith('.')]\"\n\nVerificar o resultado\n30 seg\nNo Terminal, rode o comando ls ou abra a pasta no gerenciador de arquivos.\nComo verificar: As fotos não estarão mais na raiz da pasta; em seu lugar, você verá pastas nomeadas por data (ex: 2024-05-12) contendo as imagens correspondentes."
        },
        {
          "quem": "usuario",
          "texto": "Agora rodou. Mas ficaram 1.237 fotos e não 1.240."
        },
        {
          "quem": "gemini",
          "texto": "A diferença de 3 arquivos geralmente ocorre por dois motivos: arquivos ocultos/sistema que foram ignorados pelo script ou fotos com nomes idênticos na mesma data que se sobrescreveram ao serem movidas para a mesma pasta.\n\nVerificar se os arquivos continuam na pasta raiz\n30 seg\nNo Terminal, dentro da pasta principal, execute o comando:\nls -la\nIsso listará todos os itens do diretório, incluindo arquivos ocultos (que começam com ., como ._DSC0001.JPG ou .DS_Store).\nComo verificar: Veja se aparecem 3 arquivos na listagem que não entraram nas subpastas criadas.\n\nVerificar se houve sobrescrita por nomes duplicados\n1 min\nSe a câmera reiniciou a numeração e gerou duas fotos com o mesmo nome na mesma data (ex: duas fotos chamadas DSC_0001.JPG no mesmo dia), a segunda foto substituiu a primeira ao ser movida.\nComo verificar: Abra a pasta de backup (criada antes do processo) e pesquise por nomes de arquivos duplicados para ver se existem fotos com nomes iguais.\n\nIdentificar exatamente quais arquivos estão faltando\n1 min\nPara descobrir o nome exato dos 3 arquivos ausentes sem procurar manualmente, rode o comando no Terminal (substituindo /caminho/do/backup pelo caminho real da sua pasta de backup):\n\ndiff -q -r . /caminho/do/backup | grep \"Only in /caminho/do/backup\"\n\nComo verificar: O Terminal exibirá na tela o nome exato das 3 fotos que existem no backup, mas não estão na pasta organizada."
        }
      ],